{
  "$id": "https://w3id.org/pathogen/schemas/CovidTestPassEvidenceDocument.json",
  "$schema": "http://json-schema.org/draft-07/schema#",
  "$comment": "{\"term\": \"CovidTestPassEvidenceDocument\", \"@id\": \"https://w3id.org/pathogen#CovidTestPassEvidenceDocument\"}",
  "title": "StandardCovidTestPassDetailed",
  "description": "A standard Covid19 Testpass containing detailed data",
  "type": "object",
  "properties": {
    "@context": {
      "type": "array"
    },
    "type": {
      "oneOf": [
        {
          "type": "string"
        },
        {
          "type": "array"
        }
      ]
    },
    "testType": {
      "$comment": "{\"term\": \"testType\", \"@id\": \"https://schema.org/name\"}",
      "title": "TestType",
      "description": "Type of Covid19 test",
      "type": "string"
    },
    "testCenter": {
      "$comment": "{\"term\": \"testCenter\", \"@id\": \"https://schema.org/Organization\"}",
      "title": "Test Center",
      "description": "Name and location of test center",
      "$ref": "https://w3id.org/pathogen/schemas/Organization.json"
    },
    "healthProfessionalAdministered": {
      "$comment": "{\"term\": \"healthProfessionalAdministered\", \"@id\": \"https://schema.org/description\"}",
      "title": "Health Professional Administration",
      "description": "Was test administered by a certified health professional",
      "type": "string"
    },
    "testedPerson": {
      "$comment": "{\"term\": \"testedPerson\", \"@id\": \"https://schema.org/Person\"}",
      "title": "Tested Person",
      "description": "Person receiving the test",
      "$ref": "https://w3id.org/pathogen/schemas/Person.json"
    },
    "testResult": {
      "$comment": "{\"term\": \"testResult\", \"@id\": \"https://schema.org/signDetected\"}",
      "title": "testResult",
      "description": "Result of Covid19 Test",
      "type": "string"
    },
    "testDetails": {
      "$comment": "{\"term\": \"testDetails\", \"@id\": \"https://schema.org/MedicalTest\"}",
      "title": "testDetails",
      "description": "Details of the used test",
      "$ref": "https://w3id.org/pathogen/schemas/MedicalTest.json"
    }
  },
  "additionalProperties": false,
  "examples": []
}
